{
  "schema_version": 1,
  "id": "DAE-0005",
  "title": "Historical secret.key import through the legacy Wallet importer",
  "summary": {
    "text": "A historical Daedalus workflow used a dedicated Wallet importer screen for secret.key files; the original reporter later confirmed recovery.",
    "source_ids": [
      "SRC-0008",
      "SRC-0010",
      "SRC-0011",
      "SRC-0012"
    ]
  },
  "problem": {
    "text": "The reporter retained a legacy secret.key but no recovery phrase and could not import the file into a later Daedalus installation.",
    "source_ids": [
      "SRC-0008"
    ]
  },
  "symptoms": [
    {
      "text": "A legacy secret.key is rejected when selected through the Add wallet import dialog.",
      "source_ids": [
        "SRC-0008",
        "SRC-0010"
      ]
    }
  ],
  "user_phrases": [
    {
      "text": "restore secret.key",
      "source_ids": [
        "SRC-0008"
      ]
    },
    {
      "text": "old Daedalus Wallet importer",
      "source_ids": [
        "SRC-0010"
      ]
    }
  ],
  "errors": [],
  "classification": {
    "category": "wallets",
    "subcategory": "legacy"
  },
  "applicability": {
    "daedalus": {
      "scope": "unknown",
      "min": null,
      "max": null,
      "versions": [],
      "introduced_in": null,
      "first_known_affected": null,
      "last_known_affected": null,
      "fixed_in": null,
      "notes": "The issue and comments describe a historical importer workflow but do not identify the exact supporting release in these source elements; no version is guessed."
    },
    "operating_systems": {
      "scope": "unknown",
      "values": []
    },
    "networks": {
      "scope": "unknown",
      "values": []
    },
    "hardware_wallets": {
      "scope": "not_applicable",
      "values": []
    },
    "source_ids": [
      "SRC-0008",
      "SRC-0010"
    ]
  },
  "causes": [
    {
      "kind": "confirmed",
      "claim": "The contributor identifies use of the Add wallet import dialog instead of the dedicated historical Wallet importer screen.",
      "source_ids": [
        "SRC-0010"
      ]
    }
  ],
  "diagnostics": [
    {
      "order": 1,
      "action": "For this historical case, distinguish the Add wallet import dialog from the Daedalus > Wallet importer screen.",
      "why": "The contributor states that secret.key was not accepted through the Add wallet import dialog.",
      "source_ids": [
        "SRC-0010"
      ]
    }
  ],
  "resolutions": [
    {
      "order": 1,
      "action": "In the historical Daedalus build discussed by the source, open Daedalus > Wallet importer and select the secret.key there.",
      "why": "The contributor directs the reporter to that dedicated screen rather than the Add wallet import dialog.",
      "source_ids": [
        "SRC-0010"
      ]
    }
  ],
  "expected_outcome": {
    "text": "The original reporter first states that restoration is in progress and later confirms that the wallet was recovered.",
    "source_ids": [
      "SRC-0011",
      "SRC-0012"
    ]
  },
  "do_not": [
    "Never disclose recovery phrases, seed words, or spending passwords."
  ],
  "escalate_when": [
    "The symptom persists after the safe diagnostic steps, or funds appear at risk."
  ],
  "safety": {
    "risk": "high",
    "flags": [
      "moves-wallet-data",
      "wallet-recovery",
      "funds"
    ],
    "prerequisites": [
      "Work only on a copy; preserve the original file offline."
    ],
    "consequences": [
      "Mishandling the only legacy backup may prevent recovery."
    ],
    "recovery": [
      "Return to the untouched original copy if an attempted import changes the working copy."
    ]
  },
  "evidence": {
    "classification": "single-user-confirmed",
    "confidence": "medium",
    "rationale": "A repository contributor supplies the historical navigation instruction and the original reporter separately confirms progress and recovery; exact current-version applicability is unknown.",
    "conflicts": []
  },
  "lifecycle": {
    "status": "historical",
    "superseded_by": null,
    "merged_into": null,
    "reason": "Legacy wallet format and workflow; retained for older installations.",
    "source_ids": [
      "SRC-0008",
      "SRC-0010",
      "SRC-0012"
    ]
  },
  "dates": {
    "created": "2026-08-26",
    "last_reviewed": "2026-08-27",
    "last_verified": "2019-03-21"
  },
  "sources": [
    "SRC-0008",
    "SRC-0010",
    "SRC-0011",
    "SRC-0012"
  ],
  "related_entries": [],
  "faq": {
    "eligible": false,
    "promoted": false,
    "reason": "Specialist historical recovery case."
  },
  "tags": [
    "legacy",
    "secret.key",
    "byron",
    "recovery"
  ]
}
